disease,remedy,preparation,usage
Heart attack,Arjuna (Terminalia arjuna),Boil Arjuna bark powder in water to prepare a decoction.,Drink daily as a preventive measure to strengthen the heart.
Heart block,Garlic (Allium sativum),Consume 1-2 raw garlic cloves daily.,Use to improve heart health and blood circulation.
Heart failure,Hawthorn berry (Crataegus spp.),Prepare a tea from dried hawthorn berries.,Drink daily to support cardiovascular health.
Heart palpitations,Ashwagandha (Withania somnifera),Mix Ashwagandha powder with warm milk.,Drink once daily to calm the nervous system and regulate heartbeat.
Hepatitis A,Kalmegh (Andrographis paniculata),Prepare a decoction by boiling Kalmegh leaves in water.,Drink daily to support liver function and immunity.
Hepatitis B,Kutki (Picrorhiza kurroa),Mix Kutki powder with honey or water.,Take once daily to improve liver health.
Hepatitis C,Bhumyamalaki (Phyllanthus niruri),Boil Bhumyamalaki leaves in water to prepare a tea.,Drink twice daily to support liver detoxification.
Hiatus hernia,Licorice root (Glycyrrhiza glabra),Make a tea with licorice root.,Drink before meals to soothe the stomach and esophagus.
High blood pressure (hypertension),Hibiscus (Hibiscus sabdariffa),Prepare hibiscus tea by boiling the dried flowers in water.,Drink once daily to lower blood pressure.
High cholesterol,Fenugreek seeds (Trigonella foenum-graecum),Soak fenugreek seeds overnight and consume in the morning.,Use daily to help lower cholesterol levels.
HIV,Neem (Azadirachta indica),Boil neem leaves in water to make a tea.,Drink daily to boost immunity; use alongside prescribed medications.
Hives,Aloe vera,Apply fresh Aloe vera gel directly to the affected area.,Use multiple times daily to soothe the skin and reduce itching.
Hodgkin lymphoma,Tulsi (Ocimum sanctum),Make a tea by boiling Tulsi leaves in water.,Drink daily to strengthen immunity during treatment.
Hodgkin lymphoma: Children,Brahmi (Bacopa monnieri),Prepare a tea using Brahmi leaves or capsules.,Use regularly to support neurological health; consult an expert for dosage.
Hodgkin lymphoma: Teenagers and young adults,Turmeric (Curcuma longa),Mix turmeric powder with honey or milk.,Consume daily for its anti-inflammatory and antioxidant properties.
Huntington’s disease,Brahmi (Bacopa monnieri),Prepare Brahmi tea by steeping leaves in boiling water.,Drink daily to support cognitive health and reduce neurological symptoms.
Hydrocephalus,Brahmi (Bacopa monnieri),Make a tea by boiling Brahmi leaves or powder in water.,Drink daily to support brain health and function.
Hyperglycaemia (high blood sugar),Bitter gourd (Momordica charantia),Extract juice from fresh bitter gourd.,Consume on an empty stomach daily to regulate blood sugar levels.
Hyperhidrosis,Sage (Salvia officinalis),Prepare sage tea by steeping dried sage leaves in hot water.,Drink once daily to reduce excessive sweating.
Hypoglycaemia (low blood sugar),Indian gooseberry (Amla),Consume Amla juice mixed with a pinch of salt.,Take when experiencing low blood sugar to stabilize levels.
Idiopathic pulmonary fibrosis,Vasaka (Adhatoda vasica),Prepare a decoction by boiling Vasaka leaves in water.,Drink twice daily to support respiratory health.
If your child has cold or flu symptoms,Ginger (Zingiber officinale),"Boil grated ginger with water, add honey and lemon for taste.",Give small sips throughout the day to alleviate symptoms.
Impetigo,Turmeric (Curcuma longa),Make a paste with turmeric powder and water; apply to the affected area.,Apply twice daily to reduce infection and promote healing.
Indigestion,Ajwain (Carom seeds),Boil Ajwain seeds in water and add a pinch of black salt.,Drink after meals to improve digestion.
Ingrown toenail,Tea tree oil,Mix tea tree oil with coconut oil and apply to the affected area.,Apply twice daily to reduce inflammation and prevent infection.
Infertility,Ashwagandha (Withania somnifera),Mix Ashwagandha powder with warm milk.,Consume daily to improve reproductive health.
Inflammatory bowel disease (IBD),Aloe vera,Drink fresh Aloe vera juice daily.,Consume in the morning on an empty stomach to reduce gut inflammation.
Inherited heart conditions,Arjuna (Terminalia arjuna),Prepare a decoction by boiling Arjuna bark powder in water.,Drink daily to support heart health.
Insomnia,Chamomile (Matricaria chamomilla),Brew chamomile tea with dried flowers.,Drink before bedtime to promote relaxation and better sleep.
Iron deficiency anaemia,Spinach (Spinacia oleracea),Blend fresh spinach leaves into a juice or soup.,Consume daily to boost iron levels.
Irritable bowel syndrome (IBS),Peppermint oil,Take peppermint oil capsules or brew peppermint tea.,Use as needed to alleviate abdominal cramps and bloating.
Itching,Neem (Azadirachta indica),Make a paste with neem leaves and water; apply to the itchy area.,Apply twice daily to reduce itching and inflammation.
Itchy bottom,Turmeric (Curcuma longa),Prepare a paste with turmeric powder and coconut oil; apply externally.,Apply twice daily to reduce irritation.
Itchy skin,Aloe vera,Apply fresh Aloe vera gel directly to the affected skin.,Use multiple times daily to soothe and moisturize the skin.
Joint hypermobility,Ashwagandha (Withania somnifera),Mix Ashwagandha powder with warm milk or water.,Drink daily to improve joint stability and reduce pain.
Kaposi’s sarcoma,Turmeric (Curcuma longa),Mix turmeric powder with honey and consume daily.,Use as a supportive therapy for its anti-inflammatory properties.
Kidney cancer,Punarnava (Boerhavia diffusa),Prepare a decoction by boiling Punarnava leaves in water.,Drink daily under the supervision of an Ayurvedic practitioner.
Kidney infection,Cranberry juice,"Drink fresh, unsweetened cranberry juice.",Consume twice daily to prevent and treat kidney infections.
Kidney stones,Basil (Ocimum basilicum),Extract fresh basil juice and mix with honey.,Consume daily for six months to prevent stone formation.
Labyrinthitis,Ginger (Zingiber officinale),Boil grated ginger in water to make a tea.,Drink twice daily to reduce dizziness and nausea.
Lactose intolerance,Fennel seeds (Foeniculum vulgare),Boil fennel seeds in water to make a tea.,Drink after meals to aid digestion and reduce bloating.
Laryngeal (larynx) cancer,Tulsi (Ocimum sanctum),Make a tea with Tulsi leaves.,Drink daily to boost immunity and reduce inflammation.
Laryngitis,Honey and lemon,Mix honey with warm water and add lemon juice.,Sip throughout the day to soothe the throat.
Leg cramps,Banana (rich in potassium),Eat a ripe banana daily.,Consume regularly to prevent muscle cramps.
Lichen planus,Neem (Azadirachta indica),Prepare a neem paste by grinding leaves; apply to the affected area.,Apply daily to reduce inflammation and promote healing.
Lipoedema,Gotu Kola (Centella asiatica),Brew Gotu Kola tea with dried leaves.,Drink daily to improve circulation and reduce swelling.
Liver cancer,Kutki (Picrorhiza kurroa),Prepare a decoction with Kutki powder.,Drink daily to support liver health under medical supervision.
Liver disease,Bhumyamalaki (Phyllanthus niruri),Make a tea by boiling the leaves.,Drink daily to detoxify and support liver function.
Liver tumours,Turmeric (Curcuma longa),Mix turmeric powder with milk or honey.,Consume daily for its anti-inflammatory and anti-cancer properties.
Long-term effects of COVID-19,Ashwagandha (Withania somnifera),Mix 1 tsp Ashwagandha powder in hot water.,Drink daily to boost recovery under medical guidance.
Loss of libido,Shilajit,Dissolve a pea-sized amount of Shilajit in warm water.,Drink daily to enhance libido under supervision.
Low blood pressure (hypotension),Licorice root (Glycyrrhiza glabra),Boil 1 tsp of licorice root powder in water.,Drink daily to help regulate blood pressure under guidance.
Lumbar stenosis,Turmeric (Curcuma longa),Mix 1 tsp turmeric powder in warm milk.,Drink daily to reduce inflammation and pain under supervision.
Lung cancer,Tulsi (Holy basil),Boil a few fresh Tulsi leaves in water.,Drink daily to support lung health under medical supervision.
Lupus,Flaxseed (Linum usitatissimum),Mix 1 tsp ground flaxseed in water.,Drink daily to reduce inflammation under guidance.
Lyme disease,Cat's Claw (Uncaria tomentosa),Boil 1 tsp Cat's Claw bark in water.,Drink daily to support immune function under medical supervision.
Lymphoedema,Ginger (Zingiber officinale),Boil 1 tsp grated ginger in water.,Drink daily to reduce swelling and improve circulation under guidance.
Lymphogranuloma venereum (LGV),Echinacea (Echinacea purpurea),Prepare a tea with 1 tsp dried Echinacea root in hot water.,Drink daily to support immune health under medical supervision.
Malaria,Neem (Azadirachta indica),Boil 1 tsp dried neem leaves in water.,Drink once daily to help manage symptoms under medical supervision.
Malignant brain tumour (cancerous),Turmeric (Curcuma longa),Mix 1 tsp turmeric powder in warm milk.,Drink daily to support overall health under medical guidance.
Malnutrition,Moringa (Moringa oleifera),Mix 1 tsp moringa powder in water or juice.,Drink daily to boost nutrient intake under supervision.
Managing genital symptoms,Aloe Vera,Apply fresh aloe vera gel directly to the affected area.,Use as needed to soothe irritation under medical guidance.
Measles,Papaya leaves,Crush fresh papaya leaves and extract the juice.,Drink 1-2 tsp daily to help with symptoms under supervision.
Meningitis,Holy Basil (Tulsi),Boil a few fresh Tulsi leaves in water.,Drink daily to support the immune system.
Meniere’s disease,Ginger,Brew ginger tea by boiling a few slices of fresh ginger in water.,Drink daily to help with dizziness and nausea.
Menopause,Sage,Steep 1-2 tsp dried sage leaves in hot water.,Drink daily to help manage hot flashes and night sweats.
Mesothelioma,Turmeric,Mix 1 tsp turmeric powder in warm water or milk.,Drink daily to support overall health.
Middle ear infection (otitis media),Garlic,Crush 1-2 garlic cloves and infuse in olive oil,Place a few drops in the affected ear for relief.
Migraine,Lavender,Inhale steam from boiling lavender flowers or apply diluted lavender oil to the temples.,Use during a migraine episode for relief.
Minor head injury,Arnica,Apply Arnica gel or cream to the affected area.,Use 2-3 times a day to reduce swelling and bruising.
Miscarriage,Raspberry leaf,Steep 1 tsp dried raspberry leaves in hot water.,Drink to support uterine health after a miscarriage under supervision.
Motor neurone disease (MND),Turmeric,Mix 1 tsp turmeric powder in warm water or milk.,Drink daily to support nerve health and reduce inflammation.
Mouth cancer,Aloe Vera,Apply fresh aloe vera gel directly to the affected area.,Use to soothe the mouth sores and support healing under supervision.
Mouth ulcer,Honey,Apply a small amount of raw honey directly to the ulcer.,Use 2-3 times a day to promote healing and reduce pain.
Multiple myeloma,Ashwagandha,Mix 1 tsp Ashwagandha powder in warm water or milk.,Drink daily to support immune function and reduce stress under supervision.
Multiple sclerosis (MS),Ginkgo biloba,ake 120 mg of Ginkgo biloba extract daily.,Helps improve circulation and cognitive function.
Multiple system atrophy (MSA),Gotu kola,Steep 1 tsp dried Gotu kola leaves in hot water.,Drink daily to improve circulation and nerve health.
Mumps,Lemon balm,Steep 1-2 tsp dried lemon balm leaves in hot water.,Drink daily to help reduce fever and promote relaxation.
Munchausen’s syndrome,Lavender,Inhale steam from boiling lavender flowers or use diluted lavender oil for relaxation.,Helps with stress reduction and relaxation under supervision.
Muscular dystrophy,Fish oil (Omega-3 fatty acids),Take 1-2 tsp of fish oil daily.,Helps reduce inflammation and support muscle function.
Myalgic encephalomyelitis (ME) or chronic fatigue syndrome (CFS),Rhodiola,Take 200-300 mg Rhodiola extract daily.,Helps with fatigue and improves energy levels under medical guidance.
Myasthenia gravis,Ginseng,Brew 1-2 tsp of ginseng root in hot water.,Drink daily to help improve strength and energy levels.
Nasal and sinus cancer,Turmeric,Mix 1 tsp turmeric powder in warm water or milk.,Drink daily to support overall health and reduce inflammation.
Nasopharyngeal cancer,Green tea,Steep 1-2 tsp of green tea leaves in hot water.,Drink 1-2 cups daily to support immune function.
Neck problems,Ginger,Brew ginger tea by boiling fresh ginger slices in water.,Drink daily to reduce inflammation and improve circulation.
Neuroblastoma: Children,Ashwagandha,Mix 1/4 tsp Ashwagandha powder in warm water or milk.,Give under medical supervision to help with immune support and overall vitality.
Neuroendocrine tumours,Aloe Vera,Drink fresh aloe vera juice or apply gel to affected areas.,Helps to support the immune system and promote healing.
Non-alcoholic fatty liver disease (NAFLD),Dandelion,Steep 1 tsp dried dandelion root in hot water.,Drink daily to support liver detoxification and health.
Non-Hodgkin lymphoma,Echinacea,Steep 1-2 tsp of dried Echinacea flowers in hot water.,Drink daily to help strengthen the immune system.
Non-Hodgkin lymphoma: Children,Elderberry,Make a syrup from elderberries or steep them in hot water.,Drink under medical supervision to support immune function.
Norovirus,Ginger,Brew fresh ginger slices in hot water.,Drink to relieve nausea and aid digestion.
Nosebleed,Aloe Vera,Apply fresh aloe vera gel to the nostrils.,Helps soothe and stop the bleeding by promoting healing.
Obesity,Green tea,Steep 1-2 tsp of green tea leaves in hot water.,Drink daily to help with metabolism and fat reduction.
Obsessive compulsive disorder (OCD),Lavender,Inhale steam from boiling lavender flowers or use diluted lavender oil.,Helps reduce anxiety and promote relaxation.
Obstructive sleep apnoea,Valerian root,Steep 1-2 tsp dried valerian root in hot water.,Drink before bed to improve sleep quality and reduce symptoms.
Oesophageal cancer,Aloe Vera,Drink fresh aloe vera juice.,Drink daily to soothe the digestive tract and support overall health.
Oral thrush in adults,Coconut oil,Swish 1-2 tbsp coconut oil in the mouth for 10-15 minutes (oil pulling).,Do this once or twice daily to help reduce fungal overgrowth.
Osteoarthritis,Turmeric,Mix 1 tsp turmeric powder in warm milk or water.,Drink daily to reduce inflammation and support joint health.
Osteoarthritis of the hip,Ginger,Brew ginger tea by boiling fresh ginger slices in water.,Drink daily to reduce joint inflammation and pain.
Osteoarthritis of the knee,Epsom salt,Add 1-2 cups of Epsom salt to warm bath water.,Soak the affected knee for 20 minutes to reduce pain and swelling.
Osteoarthritis of the thumb,Olive oil,Massage warm olive oil gently into the affected area.,Apply 2-3 times a day to reduce pain and stiffness.
Osteoporosis,Moringa,Mix 1 tsp moringa powder in water or juice.,Drink daily to support bone health and improve calcium absorption.
Osteosarcoma,Turmeric,Mix 1 tsp turmeric powder in warm milk or water.,Drink daily to support overall health and reduce inflammation under supervision.
Outer ear infection (otitis externa),Garlic oil,Warm garlic oil and place a few drops in the affected ear.,Use 2-3 times a day for relief.
Ovarian cancer,Green tea,Steep 1-2 tsp of green tea leaves in hot water.,Drink 1-2 cups daily to support immune function.
Ovarian cancer: Teenagers and young adults,Flaxseed,Add 1 tbsp ground flaxseed to smoothies or salads.,Consume daily to support hormone balance under medical supervision.
Ovarian cyst,Chamomile,Steep 1-2 tsp dried chamomile flowers in hot water.,Drink 1-2 cups daily to help reduce inflammation.
Overactive thyroid,Lemon balm,Steep 1 tsp dried lemon balm leaves in hot water.,Drink daily to help reduce thyroid hormone levels under guidance.
Pain in the ball of the foot,Epsom salt,Soak feet in warm water with 1-2 cups of Epsom salt.,Soak for 15-20 minutes to relieve pain and reduce inflammation.
Paget’s disease of the nipple,Coconut oil,Apply a small amount of coconut oil to the affected area.,Use twice daily to soothe and hydrate the skin.
Pancreatic cancer,Ginger,Brew ginger tea by boiling fresh ginger slices in water.,Drink daily to help with nausea and support digestion under medical supervision.
Panic disorder,Ashwagandha,Mix 1 tsp Ashwagandha powder in warm water or milk.,Drink daily to reduce stress and anxiety.
Parkinson’s disease,Ginkgo biloba,Take 120 mg of Ginkgo biloba extract daily.,Helps improve circulation and cognitive function.
Patau’s syndrome,Folic acid,"Include folate-rich foods like spinach, beans, and citrus fruits in the diet.","Supports general health during pregnancy, but not a treatment for the syndrome itself."
Patellofemoral pain syndrome,Turmeric,Mix 1 tsp turmeric powder in warm water or milk.,Drink daily to reduce inflammation and pain in the knee.
Pelvic inflammatory disease,Garlic,Crush 1-2 garlic cloves and mix with honey.,Consume daily to help with infection and support immune health.
Pelvic organ prolapse,Kegel exercises,Perform pelvic floor exercises regularly.,Helps strengthen pelvic muscles and improve support for pelvic organs.
Penile cancer,Aloe Vera,Apply fresh aloe vera gel to affected areas.,Use to soothe and promote healing under medical supervision.
Peripheral neuropathy,St. John’s Wort,Take 1-2 tsp of St. John’s Wort extract daily.,Helps improve nerve health and reduce pain.
Personality disorder,Lavender,Inhale steam from boiling lavender flowers or apply diluted lavender oil.,"Helps reduce stress, anxiety, and promote relaxation."
PIMS,Elderberry,Make a syrup or tea from elderberries.,Helps support immune function under medical supervision.
Plantar heel pain,Epsom salt,Soak feet in warm water with 1-2 cups of Epsom salt.,Soak for 15-20 minutes to relieve pain and reduce inflammation.
Pleurisy,"Vasaka (Adhatoda vasica), Tulsi (Holy Basil)",Prepare a decoction by boiling Vasaka and Tulsi leaves in water. Add honey if needed.,Drink warm twice daily to reduce inflammation and ease breathing.
Pneumonia,"Ginger, Turmeric, Tulsi","Make a tea by boiling ginger, turmeric, and Tulsi leaves in water.",Consume 2-3 times daily for anti-inflammatory and immune-boosting effects.
Polio,"Ashwagandha, Shatavari, Brahmi",Prepare a herbal decoction by boiling these herbs together or take as powder mixed in warm milk.,Take once daily to improve muscle strength and immunity.
Polycystic ovary syndrome (PCOS),"Shatavari, Ashoka, Cinnamon",Mix Shatavari powder in warm milk. Boil Ashoka bark in water to make a decoction.,Drink Shatavari milk at night and Ashoka decoction twice daily to regulate hormones.
Polymyalgia rheumatica,"Turmeric, Ginger, Guggulu",Mix turmeric and ginger powder in warm water or milk. Use Guggulu tablets or decoction.,Consume daily for reducing joint pain and inflammation.
Post-concussion syndrome,"Brahmi, Ashwagandha",Boil Brahmi leaves to make tea or take capsules. Mix Ashwagandha powder in milk.,Take Brahmi tea in the morning and Ashwagandha milk at night to support brain function.
Post-polio syndrome,"Ashwagandha, Shatavari",Prepare Ashwagandha milk or mix Shatavari powder in warm water.,Use daily to improve energy levels and strengthen muscles.
Post-traumatic stress disorder (PTSD),"Brahmi, Jatamansi, Ashwagandha",Prepare a tea using Brahmi and Jatamansi powder. Take Ashwagandha powder with milk.,Consume twice daily to calm the mind and reduce stress.
Postural orthostatic tachycardia syndrome (PoTS),"Arjuna, Brahmi",Prepare Arjuna bark tea by boiling the bark in water. Take Brahmi capsules or tea.,Take Arjuna tea twice daily to support heart health; Brahmi for nervous system balance.
Postnatal depression,"Shatavari, Ashwagandha",Mix Shatavari powder in milk. Take Ashwagandha with warm water.,Consume once or twice daily to support hormonal balance and reduce stress.
Pregnancy and baby,"Shatavari, Almond oil, Ajwain",Boil Shatavari in milk; use almond oil for massage; make Ajwain water by boiling seeds in water.,"Drink Shatavari milk daily, use almond oil for baby massage, and Ajwain water for digestion."
Pressure ulcers,"Neem oil, Turmeric",Apply Neem oil directly on the ulcer. Make a paste of turmeric and water to apply externally.,Use Neem oil twice daily and apply turmeric paste on the affected area.
Progressive supranuclear palsy (PSP),"Brahmi, Ashwagandha",Make Brahmi tea or use capsules. Mix Ashwagandha powder with milk.,Take Brahmi tea in the morning and Ashwagandha milk at night to support brain health.
Prostate cancer,"Gokshura, Turmeric",Make Gokshura decoction by boiling in water. Use turmeric in meals or with warm milk.,Drink Gokshura decoction daily and turmeric milk at night for anti-inflammatory benefits.
Psoriasis,"Neem, Aloe Vera, Turmeric",Apply Neem oil or Aloe Vera gel directly on the skin. Mix turmeric powder with coconut oil.,Use Neem or Aloe Vera gel twice daily and apply turmeric paste to affected areas.
Psoriatic arthritis,"Guggulu, Ashwagandha, Turmeric",Prepare Guggulu decoction or use tablets. Mix Ashwagandha powder in milk and use turmeric in meals.,"Take Guggulu twice daily, Ashwagandha at night, and use turmeric daily for anti-inflammatory effects."
Psychosis,"Brahmi, Jatamansi, Ashwagandha",Prepare Brahmi tea. Use Jatamansi capsules or powder. Mix Ashwagandha with milk.,Take Brahmi and Jatamansi in the morning and Ashwagandha at night to calm the mind.
Pubic lice,"Neem oil, Turmeric",Apply Neem oil directly. Make a paste of turmeric and water.,Use Neem oil twice daily and apply turmeric paste until the condition improves.
Pulmonary hypertension,"Arjuna, Tulsi, Ginger",Make Arjuna bark tea. Prepare a Tulsi and ginger tea.,Drink Arjuna tea in the morning and Tulsi-ginger tea twice daily to support respiratory health.
Phobias,"Brahmi, Jatamansi, Ashwagandha",Prepare a tea using Brahmi and Jatamansi powder. Mix Ashwagandha powder in milk.,Consume twice daily to calm the nervous system and reduce fear and anxiety.
Rare tumours,"Ashwagandha, Turmeric, Neem",Prepare a decoction of Ashwagandha root and Neem leaves. Add turmeric to meals or milk.,Consume Ashwagandha and Neem decoction twice daily and turmeric milk once daily.
Raynaud’s phenomenon,"Ginger, Turmeric, Black Pepper",Boil ginger and turmeric in water to make tea. Add black pepper for enhanced absorption.,Drink warm tea 2-3 times daily to improve circulation and reduce symptoms.
Reactive arthritis,"Guggulu, Turmeric, Ashwagandha",Prepare Guggulu decoction. Mix turmeric in milk and take Ashwagandha powder with warm water.,Use Guggulu and turmeric daily; take Ashwagandha at night for joint and immune support.
Restless legs syndrome,"Ashwagandha, Brahmi, Jatamansi",Make Brahmi tea or capsules. Prepare a mixture of Jatamansi and Ashwagandha powder in milk.,Take Brahmi tea in the evening and Ashwagandha-Jatamansi milk at night for relaxation.
Respiratory syncytial virus (RSV),"Tulsi, Ginger, Honey","Make a tea using Tulsi leaves and ginger, and sweeten with honey.",Drink 2-3 times daily to support respiratory health and ease congestion.
Retinoblastoma: Children,"Neem, Turmeric",Use Neem extract in small amounts or apply Neem oil for external cleansing. Add turmeric to meals.,Neem can be applied externally; turmeric supports immunity when used in the diet.
Rhabdomyosarcoma,"Ashwagandha, Turmeric, Amla",Prepare Ashwagandha milk or capsules. Use turmeric in meals and Amla juice or powder in water.,Consume daily to boost immunity and support the body during treatment.
Rheumatoid arthritis,"Guggulu, Turmeric, Ginger",Prepare Guggulu decoction. Mix turmeric and ginger in warm water.,Take Guggulu twice daily and turmeric-ginger water daily to reduce inflammation.
Ringworm and other fungal infections,"Neem, Turmeric, Aloe Vera",Apply Neem oil or turmeric paste directly on the affected area. Use Aloe Vera gel for soothing.,Apply Neem or turmeric twice daily and Aloe Vera as needed for relief.
Rosacea,"Neem, Aloe Vera",Apply Neem oil or Aloe Vera gel to the affected area.,Use twice daily for anti-inflammatory and cooling effects.
Scabies,"Neem, Turmeric, Tulsi",Apply Neem oil or turmeric paste. Prepare a Tulsi decoction for skin wash.,Use Neem or turmeric twice daily; bathe with Tulsi water once daily.
Scarlet fever,"Turmeric, Tulsi, Honey",Prepare a tea with Tulsi leaves and turmeric. Add honey to sweeten.,Consume 2-3 times daily to boost immunity and soothe throat irritation.
Schizophrenia,"Brahmi, Jatamansi, Ashwagandha",Prepare a tea with Brahmi and Jatamansi powder. Mix Ashwagandha powder in milk.,Take Brahmi-Jatamansi tea in the morning and Ashwagandha milk at night for calming effects.
Sciatica,"Guggulu, Ashwagandha, Ginger",Prepare Guggulu decoction. Take Ashwagandha powder with milk and boil ginger in water for tea.,"Use Guggulu twice daily, Ashwagandha at night, and ginger tea as needed for pain relief."
Seasonal affective disorder (SAD),"Brahmi, Ashwagandha, Turmeric",Make Brahmi tea or capsules. Mix Ashwagandha powder in milk and use turmeric in meals.,"Take Brahmi in the morning, Ashwagandha at night, and turmeric daily for mood support."
Sepsis,"Tulsi, Turmeric, Ginger","Make a decoction using Tulsi leaves, turmeric, and ginger.",Drink 2-3 times daily to boost immunity and fight infection.
Septic shock,"Tulsi, Turmeric",Prepare Tulsi and turmeric tea.,Consume twice daily as an adjunct to medical treatment to support immunity.
Severe head injury,"Brahmi, Jatamansi, Ashwagandha",Prepare Brahmi tea or capsules. Mix Jatamansi and Ashwagandha powders in milk.,Take Brahmi in the morning and Jatamansi-Ashwagandha at night for brain health and recovery.
Shingles,"Neem, Aloe Vera, Turmeric",Apply Neem oil or Aloe Vera gel directly. Make a paste of turmeric with water.,Use Neem or Aloe Vera twice daily and apply turmeric paste to soothe the skin.
Shortness of breath,"Tulsi, Ginger, Honey","Make a tea with Tulsi leaves and ginger, adding honey for sweetness.",Consume 2-3 times daily to ease breathing and improve lung function.
